{"schema_version":1,"project_id":"field-service-demo","piece_id":"piece-assign","audience_id":"dispatchers","intention":"Teach the first assignment","cta":"Open the dispatch board","formats":["16:9"],"fps":30,"duration_seconds":12,"scenes":[{"scene_id":"scene-1","start_seconds":0,"end_seconds":12,"narration":"Assign an urgent work order from the dispatch board.","on_screen_text":"Assign urgent work","asset_ids":["capture-assign"],"evidence_ids":["ev-assign"]}]}
