{"schema_version":1,"project_id":"learning-demo","piece_id":"piece-publish","audience_id":"authors","intention":"Show the publishing path","cta":"Create a lesson","formats":["16:9"],"fps":30,"duration_seconds":10,"scenes":[{"scene_id":"scene-1","start_seconds":0,"end_seconds":10,"narration":"Create and publish a lesson.","on_screen_text":"Publish a lesson","asset_ids":["capture-publish"],"evidence_ids":["ev-publish"]}]}
